id,game,half,start,end,text
0,england_epl/2015-2016/2015-08-29 - 17-00 Chelsea 1 - 2 Crystal Palace,1,0.888,7.836, Chelsea won this fixture 1-0 at Stamford Bridge back in May to claim the Barclays Premier League title with three games remaining.
1,england_epl/2015-2016/2015-08-29 - 17-00 Chelsea 1 - 2 Crystal Palace,1,9.818,13.702,Jose Mourinho's team had arguably done their best work in the early part of the campaign.
2,england_epl/2015-2016/2015-08-29 - 17-00 Chelsea 1 - 2 Crystal Palace,1,14.903,19.729,A 14-game unbeaten run which took them six points clear of the top by early December.
3,england_epl/2015-2016/2015-08-29 - 17-00 Chelsea 1 - 2 Crystal Palace,1,24.597,30.179, he's punching Zaha now to provide the width
4,england_epl/2015-2016/2015-08-29 - 17-00 Chelsea 1 - 2 Crystal Palace,1,31.817,32.898, Put behind by Ivanovic.
5,england_epl/2015-2016/2015-08-29 - 17-00 Chelsea 1 - 2 Crystal Palace,1,32.998,35.759,It is a first-minute corner for Crystal Palace.
6,england_epl/2015-2016/2015-08-29 - 17-00 Chelsea 1 - 2 Crystal Palace,1,36.46,39.701,He had a chat with Alan Pardew down in the media room before the game.
7,england_epl/2015-2016/2015-08-29 - 17-00 Chelsea 1 - 2 Crystal Palace,1,39.741,41.422,He said they were going to take the game to Chelsea.
8,england_epl/2015-2016/2015-08-29 - 17-00 Chelsea 1 - 2 Crystal Palace,1,41.462,42.243,"Hope they do, Tony."
9,england_epl/2015-2016/2015-08-29 - 17-00 Chelsea 1 - 2 Crystal Palace,1,42.323,44.704,It will prove to be a good one.
10,england_epl/2015-2016/2015-08-29 - 17-00 Chelsea 1 - 2 Crystal Palace,1,44.784,47.046,Palace fear no-one at the moment.
11,england_epl/2015-2016/2015-08-29 - 17-00 Chelsea 1 - 2 Crystal Palace,1,47.926,51.108,"And Chelsea, well, they need to pick it up, obviously."
12,england_epl/2015-2016/2015-08-29 - 17-00 Chelsea 1 - 2 Crystal Palace,1,54.963,56.864, Conor Wickham poised on the edge of the penalty area.
13,england_epl/2015-2016/2015-08-29 - 17-00 Chelsea 1 - 2 Crystal Palace,1,57.944,58.564,Here's Saka.
14,england_epl/2015-2016/2015-08-29 - 17-00 Chelsea 1 - 2 Crystal Palace,1,61.605,62.525,Palace get another corner.
15,england_epl/2015-2016/2015-08-29 - 17-00 Chelsea 1 - 2 Crystal Palace,1,64.286,71.868,"Back there, Saka, who's arrived from Wolverhampton, where he was top scorer in the Championship last season, his most productive season."
16,england_epl/2015-2016/2015-08-29 - 17-00 Chelsea 1 - 2 Crystal Palace,1,72.677,74.9, And he scored against Aston Villa last weekend.
17,england_epl/2015-2016/2015-08-29 - 17-00 Chelsea 1 - 2 Crystal Palace,1,78.264,79.585,Cahill with Delaney for company.
18,england_epl/2015-2016/2015-08-29 - 17-00 Chelsea 1 - 2 Crystal Palace,1,79.605,82.689,"Almost on the toes of Courtois, the Chelsea goalkeeper."
19,england_epl/2015-2016/2015-08-29 - 17-00 Chelsea 1 - 2 Crystal Palace,1,86.233,87.014,In by Punchett.
20,england_epl/2015-2016/2015-08-29 - 17-00 Chelsea 1 - 2 Crystal Palace,1,88.296,89.117,Now by Ivanovic.
21,england_epl/2015-2016/2015-08-29 - 17-00 Chelsea 1 - 2 Crystal Palace,1,91.408,92.492, Ficked up by Suada.
22,england_epl/2015-2016/2015-08-29 - 17-00 Chelsea 1 - 2 Crystal Palace,1,95.403,97.009,Finishing coming back from an offside position.
23,england_epl/2015-2016/2015-08-29 - 17-00 Chelsea 1 - 2 Crystal Palace,1,97.995,100.017," Just what you want as well on the wayside, Tony."
24,england_epl/2015-2016/2015-08-29 - 17-00 Chelsea 1 - 2 Crystal Palace,1,100.057,102.559,Just out in the opposition's last third.
25,england_epl/2015-2016/2015-08-29 - 17-00 Chelsea 1 - 2 Crystal Palace,1,102.579,104.12,Right in the early stages of the game.
26,england_epl/2015-2016/2015-08-29 - 17-00 Chelsea 1 - 2 Crystal Palace,1,104.2,106.962,Too many teams just come to Chelsea and just sit back.
27,england_epl/2015-2016/2015-08-29 - 17-00 Chelsea 1 - 2 Crystal Palace,1,107.042,109.124,I've really been looking forward to this game all week.
28,england_epl/2015-2016/2015-08-29 - 17-00 Chelsea 1 - 2 Crystal Palace,1,109.144,112.627,I think really Palace can give Chelsea a game this afternoon.
29,england_epl/2015-2016/2015-08-29 - 17-00 Chelsea 1 - 2 Crystal Palace,1,112.727,115.71,And obviously I think Chelsea are going to progress as the season goes on.
30,england_epl/2015-2016/2015-08-29 - 17-00 Chelsea 1 - 2 Crystal Palace,1,115.73,117.231,So it's set up nicely.
31,england_epl/2015-2016/2015-08-29 - 17-00 Chelsea 1 - 2 Crystal Palace,1,120.612,124.954, Paris who began the season with a 3-1 away win and newly promoted Norwich.
32,england_epl/2015-2016/2015-08-29 - 17-00 Chelsea 1 - 2 Crystal Palace,1,124.974,131.316,Ivanovic.
33,england_epl/2015-2016/2015-08-29 - 17-00 Chelsea 1 - 2 Crystal Palace,1,133.557,134.057,Now Matic.
34,england_epl/2015-2016/2015-08-29 - 17-00 Chelsea 1 - 2 Crystal Palace,1,139.465,139.906, Hazard.
35,england_epl/2015-2016/2015-08-29 - 17-00 Chelsea 1 - 2 Crystal Palace,1,142.93,144.312,Hazard has got a problem here.
36,england_epl/2015-2016/2015-08-29 - 17-00 Chelsea 1 - 2 Crystal Palace,1,144.332,145.393,He just lost his footing then.
37,england_epl/2015-2016/2015-08-29 - 17-00 Chelsea 1 - 2 Crystal Palace,1,148.017,155.767,"Just a slight groin there, I think, because Kabaye put him under a little bit of pressure, tried to nick the ball, just knocked him off balance as he was dribbling."
38,england_epl/2015-2016/2015-08-29 - 17-00 Chelsea 1 - 2 Crystal Palace,1,156.857,158.598," Just shaking himself off a little bit there, Hazard."
39,england_epl/2015-2016/2015-08-29 - 17-00 Chelsea 1 - 2 Crystal Palace,1,158.618,159.618,He just looked like he was strained.
40,england_epl/2015-2016/2015-08-29 - 17-00 Chelsea 1 - 2 Crystal Palace,1,159.638,159.718,Keha.
41,england_epl/2015-2016/2015-08-29 - 17-00 Chelsea 1 - 2 Crystal Palace,1,161.798,169.981,Matt Belakweta has seen off all comers in that left-back position for Chelsea.
42,england_epl/2015-2016/2015-08-29 - 17-00 Chelsea 1 - 2 Crystal Palace,1,172.902,173.162,Pedra.
43,england_epl/2015-2016/2015-08-29 - 17-00 Chelsea 1 - 2 Crystal Palace,1,176.192,194.327, goal for him on his Chelsea debut last weekend goal and an assist at West Brom just what they needed Chelsea to freshen it up some of them with a little bit of pace that aside from when he's got the ball when he hasn't got it he'll get after it straight away and that's the cue for the rest of the team
44,england_epl/2015-2016/2015-08-29 - 17-00 Chelsea 1 - 2 Crystal Palace,1,196.636,197.077, Ivanovic.
45,england_epl/2015-2016/2015-08-29 - 17-00 Chelsea 1 - 2 Crystal Palace,1,197.457,201.442,Now Hazard.
46,england_epl/2015-2016/2015-08-29 - 17-00 Chelsea 1 - 2 Crystal Palace,1,201.482,201.862,Willian.
47,england_epl/2015-2016/2015-08-29 - 17-00 Chelsea 1 - 2 Crystal Palace,1,203.625,204.185,Ivanovic.
48,england_epl/2015-2016/2015-08-29 - 17-00 Chelsea 1 - 2 Crystal Palace,1,204.345,206.208,Ivanovic looking for help.
49,england_epl/2015-2016/2015-08-29 - 17-00 Chelsea 1 - 2 Crystal Palace,1,206.508,207.509,Willian has provided it.
50,england_epl/2015-2016/2015-08-29 - 17-00 Chelsea 1 - 2 Crystal Palace,1,208.39,210.553,Eventually he's dispossessed by Kabat.
51,england_epl/2015-2016/2015-08-29 - 17-00 Chelsea 1 - 2 Crystal Palace,1,212.615,214.418,He's promptly given the ball to Matic.
52,england_epl/2015-2016/2015-08-29 - 17-00 Chelsea 1 - 2 Crystal Palace,1,217.998,218.319, William.
53,england_epl/2015-2016/2015-08-29 - 17-00 Chelsea 1 - 2 Crystal Palace,1,219.18,220.542,Set free by Ivanovic.
54,england_epl/2015-2016/2015-08-29 - 17-00 Chelsea 1 - 2 Crystal Palace,1,222.986,225.611,Ivanovic again.
55,england_epl/2015-2016/2015-08-29 - 17-00 Chelsea 1 - 2 Crystal Palace,1,227.833,229.915, Good play down that right-hand side from Chelsea.
56,england_epl/2015-2016/2015-08-29 - 17-00 Chelsea 1 - 2 Crystal Palace,1,229.975,231.496,Pedro eventually had his shot blocked.
57,england_epl/2015-2016/2015-08-29 - 17-00 Chelsea 1 - 2 Crystal Palace,1,231.516,232.897,"Trust me, I told you we'd be busy."
58,england_epl/2015-2016/2015-08-29 - 17-00 Chelsea 1 - 2 Crystal Palace,1,232.957,235.298,First goal of the afternoon has come at Anfield.
59,england_epl/2015-2016/2015-08-29 - 17-00 Chelsea 1 - 2 Crystal Palace,1,235.519,236.9,But not for Liverpool.
60,england_epl/2015-2016/2015-08-29 - 17-00 Chelsea 1 - 2 Crystal Palace,1,236.96,238.921,Manuel Lanzini at the back post.
61,england_epl/2015-2016/2015-08-29 - 17-00 Chelsea 1 - 2 Crystal Palace,1,239.241,241.723,"Scruffy little opener, but West Ham don't care."
62,england_epl/2015-2016/2015-08-29 - 17-00 Chelsea 1 - 2 Crystal Palace,1,241.983,242.604,What a start.
63,england_epl/2015-2016/2015-08-29 - 17-00 Chelsea 1 - 2 Crystal Palace,1,244.486,248.731," and then he fires over the top as well, but nice and sharp in that last third."
64,england_epl/2015-2016/2015-08-29 - 17-00 Chelsea 1 - 2 Crystal Palace,1,255.48,261.287,How much more business will Chelsea do before the transfer window closes at the start of next week?
65,england_epl/2015-2016/2015-08-29 - 17-00 Chelsea 1 - 2 Crystal Palace,1,263.302,267.083," You can link repeatedly with John Stones, the Everton defender."
66,england_epl/2015-2016/2015-08-29 - 17-00 Chelsea 1 - 2 Crystal Palace,1,267.844,271.705,Talk of the bid going up from just over 20 million to close to 40 million.
67,england_epl/2015-2016/2015-08-29 - 17-00 Chelsea 1 - 2 Crystal Palace,1,271.765,276.287,Everton and their owner Bill Kenwright making it absolutely clear that they're going to hold on to it.
68,england_epl/2015-2016/2015-08-29 - 17-00 Chelsea 1 - 2 Crystal Palace,1,279.977,298.845, further speculation yesterday that Chelsea might also make a move for the French international midfielder Paul Pogba of Juventus such as a revolving door in football Julian Draxler's move from Schalke of Germany to Juventus suggests that
69,england_epl/2015-2016/2015-08-29 - 17-00 Chelsea 1 - 2 Crystal Palace,1,299.773,306.238, There might be an opportunity for the Italians who reached the Champions League final to say goodbye to Pogba.
70,england_epl/2015-2016/2015-08-29 - 17-00 Chelsea 1 - 2 Crystal Palace,1,306.258,312.504,Black armbands today for all the Crystal Palace staff.
71,england_epl/2015-2016/2015-08-29 - 17-00 Chelsea 1 - 2 Crystal Palace,1,314.264,318.068, Mark of respect for Yannick Balassi's father who died last weekend.
72,england_epl/2015-2016/2015-08-29 - 17-00 Chelsea 1 - 2 Crystal Palace,1,318.108,321.532,But Balassi is on the bench for Palace again today.
73,england_epl/2015-2016/2015-08-29 - 17-00 Chelsea 1 - 2 Crystal Palace,1,323.374,325.796,Both his parents used to watch all his games.
74,england_epl/2015-2016/2015-08-29 - 17-00 Chelsea 1 - 2 Crystal Palace,1,328.819,329.16,Saka.
75,england_epl/2015-2016/2015-08-29 - 17-00 Chelsea 1 - 2 Crystal Palace,1,332.059,333.48, I like the way Palace are lining up.
76,england_epl/2015-2016/2015-08-29 - 17-00 Chelsea 1 - 2 Crystal Palace,1,333.76,336.321,"Conor Wickham up front, really, the furthest up front."
77,england_epl/2015-2016/2015-08-29 - 17-00 Chelsea 1 - 2 Crystal Palace,1,336.401,340.283,"He's the spearhead of the attack, but there's plenty of pace in and around him."
78,england_epl/2015-2016/2015-08-29 - 17-00 Chelsea 1 - 2 Crystal Palace,1,341.504,341.824,Saka.
79,england_epl/2015-2016/2015-08-29 - 17-00 Chelsea 1 - 2 Crystal Palace,1,343.005,344.446,Now punching in the central area.
80,england_epl/2015-2016/2015-08-29 - 17-00 Chelsea 1 - 2 Crystal Palace,1,348.408,348.628,Ward.
81,england_epl/2015-2016/2015-08-29 - 17-00 Chelsea 1 - 2 Crystal Palace,1,349.994,362.741, Fonsi giving Matic the slip Zaha taking on Ivanovic Palace get the corner
82,england_epl/2015-2016/2015-08-29 - 17-00 Chelsea 1 - 2 Crystal Palace,1,363.806,379.8," Well, he's been got at the last couple of weeks, hasn't he, Ivanovic, in that right-back spot, no doubt they'll target him today, one-on-one situations, a little bit unlucky here, Zard gets the ball to his feet, tries to get to the dead ball line, twisting and turning Ivanovic, but this time he defends well, gets his block in."
83,england_epl/2015-2016/2015-08-29 - 17-00 Chelsea 1 - 2 Crystal Palace,1,381.291,384.013, Palace have got that attacking option up there all around Wiccan.
84,england_epl/2015-2016/2015-08-29 - 17-00 Chelsea 1 - 2 Crystal Palace,1,386.054,389.616,Palace have shown already this season that they can be invented with their set plays.
85,england_epl/2015-2016/2015-08-29 - 17-00 Chelsea 1 - 2 Crystal Palace,1,390.777,391.998,That is not the best example.
86,england_epl/2015-2016/2015-08-29 - 17-00 Chelsea 1 - 2 Crystal Palace,1,401.061,409.226," It seems very important when you have got that place, the likes of Sakho and Zaha punching in the middle of the park there, that you have someone who can supply the passes."
87,england_epl/2015-2016/2015-08-29 - 17-00 Chelsea 1 - 2 Crystal Palace,1,409.266,411.928,And the acquisition of Kabay has been outstanding.
88,england_epl/2015-2016/2015-08-29 - 17-00 Chelsea 1 - 2 Crystal Palace,1,412.408,417.632,He's the one who can see a pass that fraction of a second earlier and obviously release those players that bit quicker.
89,england_epl/2015-2016/2015-08-29 - 17-00 Chelsea 1 - 2 Crystal Palace,1,421.806,424.229, Dubai worked under Alan Pardew at Newcastle.
90,england_epl/2015-2016/2015-08-29 - 17-00 Chelsea 1 - 2 Crystal Palace,1,425.43,433.921,Wickens challenge.
91,england_epl/2015-2016/2015-08-29 - 17-00 Chelsea 1 - 2 Crystal Palace,1,437.625,441.85, And you can see a little bit of a changing around in those three behind Costa already.
92,england_epl/2015-2016/2015-08-29 - 17-00 Chelsea 1 - 2 Crystal Palace,1,441.87,443.792,"You've got Pedro, Willian and Hazard."
93,england_epl/2015-2016/2015-08-29 - 17-00 Chelsea 1 - 2 Crystal Palace,1,443.832,445.474,They're going to rotate.
94,england_epl/2015-2016/2015-08-29 - 17-00 Chelsea 1 - 2 Crystal Palace,1,445.534,449.418,"They won't be liking to get stuck left, right and middle, so to speak."
95,england_epl/2015-2016/2015-08-29 - 17-00 Chelsea 1 - 2 Crystal Palace,1,449.799,451.441,You'll find them rotating during the game.
96,england_epl/2015-2016/2015-08-29 - 17-00 Chelsea 1 - 2 Crystal Palace,1,458.82,463.626, Azuma has really developed at Stamford Bridge in the last 12 months or so.
97,england_epl/2015-2016/2015-08-29 - 17-00 Chelsea 1 - 2 Crystal Palace,1,463.666,466.449,He made his Premier League debut at this time last year.
98,england_epl/2015-2016/2015-08-29 - 17-00 Chelsea 1 - 2 Crystal Palace,1,466.649,466.969,Matic.
99,england_epl/2015-2016/2015-08-29 - 17-00 Chelsea 1 - 2 Crystal Palace,1,466.989,467.21,Fabregas.
100,england_epl/2015-2016/2015-08-29 - 17-00 Chelsea 1 - 2 Crystal Palace,1,480.429,498.954," Good start for Pallastoni, we're only just coming up to the 8 minute mark but they've started really well on the front foot."
101,england_epl/2015-2016/2015-08-29 - 17-00 Chelsea 1 - 2 Crystal Palace,1,499.844,501.065, Trying to close Chelsea down.
102,england_epl/2015-2016/2015-08-29 - 17-00 Chelsea 1 - 2 Crystal Palace,1,501.105,502.505,They're trying to meet them high as well.
103,england_epl/2015-2016/2015-08-29 - 17-00 Chelsea 1 - 2 Crystal Palace,1,502.525,506.487,They're not allowing Chelsea to have possession easy in that back line.
104,england_epl/2015-2016/2015-08-29 - 17-00 Chelsea 1 - 2 Crystal Palace,1,507.447,509.888,"Every time Matic gets the ball, someone gets around him."
105,england_epl/2015-2016/2015-08-29 - 17-00 Chelsea 1 - 2 Crystal Palace,1,510.068,513.19,Because Matic is the one that starts it off and they have to stop that supply.
106,england_epl/2015-2016/2015-08-29 - 17-00 Chelsea 1 - 2 Crystal Palace,1,524.411,525.312, That same towards Weka.
107,england_epl/2015-2016/2015-08-29 - 17-00 Chelsea 1 - 2 Crystal Palace,1,525.332,527.795,And jump by Matic.
108,england_epl/2015-2016/2015-08-29 - 17-00 Chelsea 1 - 2 Crystal Palace,1,527.815,528.136,Diego Costa.
109,england_epl/2015-2016/2015-08-29 - 17-00 Chelsea 1 - 2 Crystal Palace,1,535.964,539.247," many of these anymore direct from a free kick, but Sunderland have just come up with one."
110,england_epl/2015-2016/2015-08-29 - 17-00 Chelsea 1 - 2 Crystal Palace,1,539.927,541.308,The away teams are at it again.
111,england_epl/2015-2016/2015-08-29 - 17-00 Chelsea 1 - 2 Crystal Palace,1,541.649,547.734,"Jan and Bea this time with a beautifully struck free kick, but I'm guessing questions will be asked in the Villa defence."
112,england_epl/2015-2016/2015-08-29 - 17-00 Chelsea 1 - 2 Crystal Palace,1,547.974,548.534,"Sunderland lead, 1-0."
113,england_epl/2015-2016/2015-08-29 - 17-00 Chelsea 1 - 2 Crystal Palace,1,550.903,555.269, and bent for fixture which you saw in October of last year.
114,england_epl/2015-2016/2015-08-29 - 17-00 Chelsea 1 - 2 Crystal Palace,1,555.289,558.113,It was one which was marked by a couple of dismissals.
115,england_epl/2015-2016/2015-08-29 - 17-00 Chelsea 1 - 2 Crystal Palace,1,558.153,561.398,Delaney sent off for Palace and Nathalaqueta
116,england_epl/2015-2016/2015-08-29 - 17-00 Chelsea 1 - 2 Crystal Palace,1,562.799,580.403, Chelsea again that was referee by today's referee Greg Corson yeah and I think both the decisions were correct ones the two sending offs one for Delaney obviously and Aspilicueta he was a straight red but it was a good game of football I must admit and I don't think this one's going to be any different today
117,england_epl/2015-2016/2015-08-29 - 17-00 Chelsea 1 - 2 Crystal Palace,1,582.659,584.48, He has changed at Palace since then.
118,england_epl/2015-2016/2015-08-29 - 17-00 Chelsea 1 - 2 Crystal Palace,1,585.921,588.643,Will Wormack was in charge.
119,england_epl/2015-2016/2015-08-29 - 17-00 Chelsea 1 - 2 Crystal Palace,1,592.827,597.43,Palace taking a change of direction in the new year when they turn to Alan Cardew.
120,england_epl/2015-2016/2015-08-29 - 17-00 Chelsea 1 - 2 Crystal Palace,1,598.291,598.631,That's that.
121,england_epl/2015-2016/2015-08-29 - 17-00 Chelsea 1 - 2 Crystal Palace,1,601.749,602.109, And again by Zouma.
122,england_epl/2015-2016/2015-08-29 - 17-00 Chelsea 1 - 2 Crystal Palace,1,602.129,602.229,Pedra.
123,england_epl/2015-2016/2015-08-29 - 17-00 Chelsea 1 - 2 Crystal Palace,1,602.249,602.97,There's old Barcelona buddy Fabregas.
124,england_epl/2015-2016/2015-08-29 - 17-00 Chelsea 1 - 2 Crystal Palace,1,602.99,603.21,Pedra again.
125,england_epl/2015-2016/2015-08-29 - 17-00 Chelsea 1 - 2 Crystal Palace,1,621.371,623.031, This is where Palace has just dropped off now.
126,england_epl/2015-2016/2015-08-29 - 17-00 Chelsea 1 - 2 Crystal Palace,1,623.051,624.312,Just dropped off a little bit deeper.
127,england_epl/2015-2016/2015-08-29 - 17-00 Chelsea 1 - 2 Crystal Palace,1,624.332,627.333,"When Chelsea have got good possession, then they have to drop off."
128,england_epl/2015-2016/2015-08-29 - 17-00 Chelsea 1 - 2 Crystal Palace,1,627.353,630.253,And you've got to stop Chelsea getting in between the lines.
129,england_epl/2015-2016/2015-08-29 - 17-00 Chelsea 1 - 2 Crystal Palace,1,632.714,633.034,William.
130,england_epl/2015-2016/2015-08-29 - 17-00 Chelsea 1 - 2 Crystal Palace,1,639.116,640.616,Super cross for a pass by William.
131,england_epl/2015-2016/2015-08-29 - 17-00 Chelsea 1 - 2 Crystal Palace,1,641.681,642.222, Fabregas.
132,england_epl/2015-2016/2015-08-29 - 17-00 Chelsea 1 - 2 Crystal Palace,1,644.565,646.948,Razaev for 1-1 at Villa Park.
133,england_epl/2015-2016/2015-08-29 - 17-00 Chelsea 1 - 2 Crystal Palace,1,647.048,647.489,Penalty.
134,england_epl/2015-2016/2015-08-29 - 17-00 Chelsea 1 - 2 Crystal Palace,1,647.689,648.79,Great chance to respond.
135,england_epl/2015-2016/2015-08-29 - 17-00 Chelsea 1 - 2 Crystal Palace,1,648.85,650.553,Haven't held the league long enough.
136,england_epl/2015-2016/2015-08-29 - 17-00 Chelsea 1 - 2 Crystal Palace,1,650.613,654.618,"Lee Catamol with a ridiculous challenge, giving away the penalty."
137,england_epl/2015-2016/2015-08-29 - 17-00 Chelsea 1 - 2 Crystal Palace,1,655.179,658.784,Sinclair fresh from his goal-scoring exploits in midweek.
138,england_epl/2015-2016/2015-08-29 - 17-00 Chelsea 1 - 2 Crystal Palace,1,660.131,661.353, No problem.
139,england_epl/2015-2016/2015-08-29 - 17-00 Chelsea 1 - 2 Crystal Palace,1,661.373,661.393,1-1.
140,england_epl/2015-2016/2015-08-29 - 17-00 Chelsea 1 - 2 Crystal Palace,1,666.359,673.688,Diego Costa.
141,england_epl/2015-2016/2015-08-29 - 17-00 Chelsea 1 - 2 Crystal Palace,1,673.708,677.713,"Lots of good Chelsea passing, but really can't get in between the Palace players there."
142,england_epl/2015-2016/2015-08-29 - 17-00 Chelsea 1 - 2 Crystal Palace,1,677.733,678.654,That's good defending.
143,england_epl/2015-2016/2015-08-29 - 17-00 Chelsea 1 - 2 Crystal Palace,1,680.199,685.624," which is what they don't want Palace to leave Conor Wickham isolated against the two, Zouma and Keogh."
144,england_epl/2015-2016/2015-08-29 - 17-00 Chelsea 1 - 2 Crystal Palace,1,686.444,692.43,"Even when they break play up, they've got to be brave and try to pass it out rather than trying to hit the front man straight away who's going to become isolated."
145,england_epl/2015-2016/2015-08-29 - 17-00 Chelsea 1 - 2 Crystal Palace,1,700.598,713.881, a wicket who scored for Sunderland here in the early part of last year one and only defeat in 51 Jose Mourinho's Chelsea or home defeat in his two styles as a manager in the Premier League
146,england_epl/2015-2016/2015-08-29 - 17-00 Chelsea 1 - 2 Crystal Palace,1,715.595,722.799, This is his 100th home fixture and to complete the symmetry it's his 200th game in the Premier League in charge of Chelsea.
147,england_epl/2015-2016/2015-08-29 - 17-00 Chelsea 1 - 2 Crystal Palace,1,725.041,727.862,Fabregas.
148,england_epl/2015-2016/2015-08-29 - 17-00 Chelsea 1 - 2 Crystal Palace,1,727.882,728.042,Willian.
149,england_epl/2015-2016/2015-08-29 - 17-00 Chelsea 1 - 2 Crystal Palace,1,736.834,737.656, There's no way to go Sackler dispossessed
150,england_epl/2015-2016/2015-08-29 - 17-00 Chelsea 1 - 2 Crystal Palace,1,749.428,750.349, First shot on target.
151,england_epl/2015-2016/2015-08-29 - 17-00 Chelsea 1 - 2 Crystal Palace,1,751.05,754.534,No real danger for the keeper there.
152,england_epl/2015-2016/2015-08-29 - 17-00 Chelsea 1 - 2 Crystal Palace,1,754.734,756.396,"McCarthy, that was an easy one to pick up."
153,england_epl/2015-2016/2015-08-29 - 17-00 Chelsea 1 - 2 Crystal Palace,1,756.456,758.918,"But again, Chelsea trying to move the ball about."
154,england_epl/2015-2016/2015-08-29 - 17-00 Chelsea 1 - 2 Crystal Palace,1,759.179,762.582,"Palace just got caught in possession there, but that shouldn't frighten them."
155,england_epl/2015-2016/2015-08-29 - 17-00 Chelsea 1 - 2 Crystal Palace,1,762.602,763.844,They've still got to play their way up.
156,england_epl/2015-2016/2015-08-29 - 17-00 Chelsea 1 - 2 Crystal Palace,1,773.703,775.147, He didn't put any shoulder into that.
157,england_epl/2015-2016/2015-08-29 - 17-00 Chelsea 1 - 2 Crystal Palace,1,776.751,777.192,Talis free kick.
158,england_epl/2015-2016/2015-08-29 - 17-00 Chelsea 1 - 2 Crystal Palace,1,777.333,781.704,That's a free kick which has irritated Jose Mourinho.
159,england_epl/2015-2016/2015-08-29 - 17-00 Chelsea 1 - 2 Crystal Palace,1,788.497,790.918, Sometimes I feel it's a little bit of an act down there for Jose.
160,england_epl/2015-2016/2015-08-29 - 17-00 Chelsea 1 - 2 Crystal Palace,1,790.998,792.979,"And he's acting for his own purposes, the team."
161,england_epl/2015-2016/2015-08-29 - 17-00 Chelsea 1 - 2 Crystal Palace,1,793.599,795.3,Trying to show his commitment to the team.
162,england_epl/2015-2016/2015-08-29 - 17-00 Chelsea 1 - 2 Crystal Palace,1,795.32,796.721,I think this is clearly a foul.
163,england_epl/2015-2016/2015-08-29 - 17-00 Chelsea 1 - 2 Crystal Palace,1,796.741,799.442,"Look, William just pushes into Ward."
164,england_epl/2015-2016/2015-08-29 - 17-00 Chelsea 1 - 2 Crystal Palace,1,799.462,800.322,That's clearly a foul.
165,england_epl/2015-2016/2015-08-29 - 17-00 Chelsea 1 - 2 Crystal Palace,1,800.342,801.903,So I don't think we can have any grumbles there.
166,england_epl/2015-2016/2015-08-29 - 17-00 Chelsea 1 - 2 Crystal Palace,1,801.923,805.064,But just trying to show his commitment to the team and the course.
167,england_epl/2015-2016/2015-08-29 - 17-00 Chelsea 1 - 2 Crystal Palace,1,806.105,806.905,Trying to get them going.
168,england_epl/2015-2016/2015-08-29 - 17-00 Chelsea 1 - 2 Crystal Palace,1,810.074,816.385," As the manager was saying this week, Chelsea, the team that everybody loves to see beaten."
169,england_epl/2015-2016/2015-08-29 - 17-00 Chelsea 1 - 2 Crystal Palace,1,816.405,820.493,"Of course, in that siege mentality."
170,england_epl/2015-2016/2015-08-29 - 17-00 Chelsea 1 - 2 Crystal Palace,1,820.553,823.278,In by Hazard.
171,england_epl/2015-2016/2015-08-29 - 17-00 Chelsea 1 - 2 Crystal Palace,1,838.729,839.23, Ambitious from William.
172,england_epl/2015-2016/2015-08-29 - 17-00 Chelsea 1 - 2 Crystal Palace,1,848.004,851.105," Well, he doesn't mind having a go, but he's not got that great a goal-scoring record."
173,england_epl/2015-2016/2015-08-29 - 17-00 Chelsea 1 - 2 Crystal Palace,1,851.125,856.187,"I think he's a super player for Chelsea, whether he plays right or left or middle in the three behind Costa."
174,england_epl/2015-2016/2015-08-29 - 17-00 Chelsea 1 - 2 Crystal Palace,1,856.747,862.849,"Certainly works hard, gets after the ball, he's good on the ball, but that finishing shot or pass has got to improve."
175,england_epl/2015-2016/2015-08-29 - 17-00 Chelsea 1 - 2 Crystal Palace,1,863.39,864.41,"He's a quality player, but..."
